school_id,school,school_1,School_level,School_name,Location,Matched_district,Match_percent,Location_1
191,"जनता माध्यमिक विद्यालय माई नगरपालिका, इलाम",जनता मावि माई नगरपालिका इलाम,मावि,जनता,माई नगरपालिका इलाम,इलाम,100,माई नगरपालिका
192,"थोकफेला प्राथमिक विधालय, इलाम",थोकफेला प्रावि इलाम,प्रावि,थोकफेला,इलाम,इलाम,100,
193,"नारायण जन माध्यमिक विधालय मच्छेगाउँ, काठमाडौं",नारायण जन मावि मच्छेगाउँ काठमाडौं,मावि,नारायण जन,मच्छेगाउँ काठमाडौं,काठमाडौं,100,मच्छेगाउँ
194,"विणापाणी माध्यमिक विद्यालय, इलाम",विणापाणी मावि इलाम,मावि,विणापाणी,इलाम,इलाम,100,
195,"बाँझोगाउँ माध्यमिक विद्यालय चुलाचुली, इलाम",बाँझोगाउँ मावि चुलाचुली इलाम,मावि,बाँझोगाउँ,चुलाचुली इलाम,इलाम,100,चुलाचुली
196,"सिद्ध देवी प्राथमिक विधालय पुवामजुवा, इलाम",सिद्ध देवी प्रावि पुवामजुवा इलाम,प्रावि,सिद्ध देवी,पुवामजुवा इलाम,इलाम,100,पुवामजुवा
197,"सिद्धदेउमाई निम्न माध्यमिक विधालय चयैता, इलाम",सिद्धदेउमाई निमावि चयैता इलाम,निमावि,सिद्धदेउमाई,चयैता इलाम,इलाम,100,चयैता
198,"डम्बर देवी माध्यमिक विद्यालय, इलाम",डम्बर देवी मावि इलाम,मावि,डम्बर देवी,इलाम,इलाम,100,
199,"माहेन्द्र माध्यमिक विद्यालय, तनहुँ",माहेन्द्र मावि तनहुँँ,मावि,माहेन्द्र,तनहुँ,तनहुँ,100,
